{
  "pcqId": "UPDATE-INTEG-TEST",
  "ccdCaseId": "CCD-Case-2",
  "partyId": "23",
  "channel": 1,
  "completedDate": "2020-03-05T09:13:46.000Z",
  "serviceId": "PROBATE",
  "actor": "RESPONDENT",
  "versionNo": 1,
  "pcqAnswers": {
    "dob_provided": 1,
    "dob": "1985-01-01T00:00:00.000Z",
    "language_main": 0,
    "language_other": "TestLanguage",
    "english_language_level": 3,
    "sex": null,
    "gender_different": 2,
    "gender_other": "TestGender",
    "sexuality": 4,
    "sexuality_other": "OtherSexuality",
    "marriage": 1,
    "ethnicity": 18,
    "ethnicity_other": "TestOtherEthnicity",
    "religion": 8,
    "religion_other": "TestOtherReligion",
    "disability_conditions": 1,
    "disability_impact": 0,
    "disability_vision": 0,
    "disability_hearing": 1,
    "disability_mobility": null,
    "disability_dexterity": 0,
    "disability_learning": 1,
    "disability_memory": 1,
    "disability_mental_health": 0,
    "disability_stamina": 0,
    "disability_social": 1,
    "disability_other": 1,
    "disability_other_details": "Other test disabilities",
    "disability_none": 0,
    "pregnancy": 2
  }
}
